{
  "files": [
    {
      "audit": "_audits/basket.json",
      "input_sha256": "f7e848f39dac0f87e4ef7fe3604e6661e6bd8edd7782b0804f714ae811ce8203",
      "mapped_instructions": 270,
      "opcode_recognition_fraction": 1.0,
      "output": "basket.php",
      "semantic_equivalence_proven": false,
      "serialized_instructions": 270,
      "source": "basket.php",
      "status": "candidate_generated",
      "syntax_checked": true,
      "syntax_passed": true,
      "unknown_windows": []
    },
    {
      "audit": "_audits/course_get.json",
      "input_sha256": "0d5ef7ea17ef2eef826d758929dcd7c0ed8f9f83da08a9f99ad517bc758fca09",
      "mapped_instructions": 59,
      "opcode_recognition_fraction": 1.0,
      "output": "course_get.php",
      "semantic_equivalence_proven": false,
      "serialized_instructions": 59,
      "source": "course_get.php",
      "status": "candidate_generated",
      "syntax_checked": true,
      "syntax_passed": true,
      "unknown_windows": []
    },
    {
      "audit": "_audits/fun_all.json",
      "failure_context": {
        "block_start_index_hint": 16,
        "block_window": {
          "approximate_block_start": true,
          "expected": "Instruction sequence locally decodable with resolved temporaries and calls",
          "found": "Cannot restore out_link: structured: out_link block B016: Unresolved temporary (2, 0, 0); state fallback: Unresolved temporary (2, 0, 0)",
          "group": "out_link",
          "index": 16,
          "window": [
            {
              "confidence": "inferred",
              "index": 14,
              "key": "6:96",
              "line": 67,
              "mapped_opcode": 18,
              "name": "IS_NOT_EQUAL",
              "raw_encoded_opcode": 96
            },
            {
              "confidence": "inferred",
              "index": 15,
              "key": "7:107",
              "line": 67,
              "mapped_opcode": 52,
              "name": "BOOL",
              "raw_encoded_opcode": 107
            },
            {
              "confidence": "inferred",
              "index": 16,
              "key": "0:161",
              "line": 68,
              "mapped_opcode": 43,
              "name": "JMPZ",
              "raw_encoded_opcode": 161
            },
            {
              "confidence": "inferred",
              "index": 17,
              "key": "1:90",
              "line": 69,
              "mapped_opcode": 41,
              "name": "PRINT",
              "raw_encoded_opcode": 90
            },
            {
              "confidence": "inferred",
              "index": 18,
              "key": "2:236",
              "line": 69,
              "mapped_opcode": 70,
              "name": "FREE",
              "raw_encoded_opcode": 236
            }
          ]
        },
        "index_precision": "start of failing CFG basic block; exact failing opcode not independently identified",
        "message": "Cannot restore out_link: structured: out_link block B016: Unresolved temporary (2, 0, 0); state fallback: Unresolved temporary (2, 0, 0)",
        "type": "Unsupported"
      },
      "input_sha256": "2e3a30bee58e1f2169b168441819f0f342904ba9958a8cd7ed6648ef9eb0dc72",
      "mapped_instructions": 1629,
      "opcode_recognition_fraction": 0.9987737584304108,
      "partial_diagnostic": "_partial_READ_ONLY/fun_all.txt",
      "reason": "Unsupported: Cannot restore out_link: structured: out_link block B016: Unresolved temporary (2, 0, 0); state fallback: Unresolved temporary (2, 0, 0)",
      "recoverable_group_fraction": 0.5217391304347826,
      "recoverable_groups": 12,
      "semantic_equivalence_proven": false,
      "serialized_instructions": 1631,
      "source": "fun_all.php",
      "status": "unsupported",
      "total_groups": 23,
      "unknown_windows": [
        {
          "expected": "uniquely mapped opcode",
          "found": "unmapped empirical key",
          "group": "out_price",
          "index": 65,
          "window": [
            {
              "confidence": "inferred",
              "index": 63,
              "key": "7:98",
              "line": 154,
              "mapped_opcode": 77,
              "name": "FE_RESET",
              "raw_encoded_opcode": 98
            },
            {
              "confidence": "inferred",
              "index": 64,
              "key": "0:24",
              "line": 154,
              "mapped_opcode": 78,
              "name": "FE_FETCH",
              "raw_encoded_opcode": 24
            },
            {
              "confidence": "unknown",
              "index": 65,
              "key": "1:199",
              "line": 154,
              "mapped_opcode": null,
              "name": null,
              "raw_encoded_opcode": 199
            },
            {
              "confidence": "inferred",
              "index": 66,
              "key": "2:42",
              "line": 154,
              "mapped_opcode": 38,
              "name": "ASSIGN",
              "raw_encoded_opcode": 42
            },
            {
              "confidence": "inferred",
              "index": 67,
              "key": "3:9",
              "line": 154,
              "mapped_opcode": 70,
              "name": "FREE",
              "raw_encoded_opcode": 9
            }
          ]
        },
        {
          "expected": "uniquely mapped opcode",
          "found": "unmapped empirical key",
          "group": "uc_rus",
          "index": 17,
          "window": [
            {
              "confidence": "inferred",
              "index": 15,
              "key": "7:98",
              "line": 191,
              "mapped_opcode": 77,
              "name": "FE_RESET",
              "raw_encoded_opcode": 98
            },
            {
              "confidence": "inferred",
              "index": 16,
              "key": "0:24",
              "line": 191,
              "mapped_opcode": 78,
              "name": "FE_FETCH",
              "raw_encoded_opcode": 24
            },
            {
              "confidence": "unknown",
              "index": 17,
              "key": "1:199",
              "line": 191,
              "mapped_opcode": null,
              "name": null,
              "raw_encoded_opcode": 199
            },
            {
              "confidence": "inferred",
              "index": 18,
              "key": "2:42",
              "line": 191,
              "mapped_opcode": 38,
              "name": "ASSIGN",
              "raw_encoded_opcode": 42
            },
            {
              "confidence": "inferred",
              "index": 19,
              "key": "3:9",
              "line": 191,
              "mapped_opcode": 70,
              "name": "FREE",
              "raw_encoded_opcode": 9
            }
          ]
        }
      ]
    },
    {
      "audit": "_audits/get_wares.json",
      "input_sha256": "71ed43508bcdfdb4f68c4940bae62532264690dd13f41738150cbc2a4a82c569",
      "mapped_instructions": 488,
      "opcode_recognition_fraction": 1.0,
      "output": "get_wares.php",
      "semantic_equivalence_proven": false,
      "serialized_instructions": 488,
      "source": "get_wares.php",
      "status": "candidate_generated",
      "syntax_checked": true,
      "syntax_passed": true,
      "unknown_windows": []
    },
    {
      "audit": "_audits/gr_wares1.json",
      "input_sha256": "2d5e3bdf21bb1eea6935ca5ec5350382ef2684239568674a99621dd0625c2d54",
      "mapped_instructions": 870,
      "opcode_recognition_fraction": 1.0,
      "output": "gr_wares1.php",
      "semantic_equivalence_proven": false,
      "serialized_instructions": 870,
      "source": "gr_wares1.php",
      "status": "candidate_generated",
      "syntax_checked": true,
      "syntax_passed": true,
      "unknown_windows": []
    },
    {
      "audit": "_audits/header_admin.json",
      "input_sha256": "4ec12441d7cf0b2645052f8d6def7de1a21a12d17082e213696444a14dcc8110",
      "semantic_equivalence_proven": false,
      "source": "header_admin.php",
      "status": "not_encoded"
    },
    {
      "audit": "_audits/header_index(1).json",
      "input_sha256": "1c5fa919febfd89b0c662d1052919fc6b516c4a3337ab98e796f156f32378b5b",
      "mapped_instructions": 12,
      "opcode_recognition_fraction": 1.0,
      "output": "header_index(1).php",
      "semantic_equivalence_proven": false,
      "serialized_instructions": 12,
      "source": "header_index(1).php",
      "status": "candidate_generated",
      "syntax_checked": true,
      "syntax_passed": true,
      "unknown_windows": []
    },
    {
      "audit": "_audits/import(1).json",
      "input_sha256": "c04564a8e50cad0a1106eaa82e2d91dba576d1317f0e783a21284281c877b919",
      "mapped_instructions": 917,
      "opcode_recognition_fraction": 1.0,
      "output": "import(1).php",
      "semantic_equivalence_proven": false,
      "serialized_instructions": 917,
      "source": "import(1).php",
      "status": "candidate_generated",
      "syntax_checked": true,
      "syntax_passed": true,
      "unknown_windows": []
    },
    {
      "audit": "_audits/links_fun(1).json",
      "failure_context": {
        "block_start_index_hint": 12,
        "block_window": {
          "approximate_block_start": true,
          "expected": "Instruction sequence locally decodable with resolved temporaries and calls",
          "found": "Cannot restore <main>: structured: <main> block B012: SEND without call; state fallback: SEND without call",
          "group": "<main>",
          "index": 12,
          "window": [
            {
              "confidence": "inferred",
              "index": 10,
              "key": "2:36",
              "line": 229,
              "mapped_opcode": 17,
              "name": "IS_EQUAL",
              "raw_encoded_opcode": 36
            },
            {
              "confidence": "inferred",
              "index": 11,
              "key": "3:185",
              "line": 230,
              "mapped_opcode": 43,